{
  "schema_version": "gopulse.phase20.capacity-profile.v1",
  "profile_id": "phase20-isolated-diagnostic",
  "target_candidate_version": "2.1.4",
  "host": {
    "platform": "linux/amd64",
    "host_os": "Linux",
    "kernel_contains": "WSL2",
    "cpu_count_min": 8,
    "memory_bytes_min": 12884901888,
    "swap_bytes_min": 8589934592,
    "disk_free_bytes_min": 107374182400,
    "docker_server_os": "linux",
    "docker_server_arch": "amd64",
    "compose_min_version": "2.24.0"
  },
  "recipe": {
    "schema_version": "gopulse.phase18.recipe.v1",
    "seed": 18002005,
    "counts": {
      "users": 5000,
      "posts": 50000,
      "comments": 100000,
      "post_likes": 200000,
      "user_follows": 200000,
      "post_bookmarks": 25000,
      "business_outbox": 550000,
      "notifications": 500000
    },
    "id_ranges": {
      "users": {
        "first": 1,
        "last": 5000
      },
      "posts": {
        "first": 1,
        "last": 50000
      },
      "comments": {
        "first": 1,
        "last": 100000
      }
    },
    "digest": "sha256:0e61a5473f72d735ab322261e312290249f39997b649837fea32bfe2c947cf14"
  },
  "workload": {
    "virtual_users": 1024,
    "request_timeout_seconds": 5,
    "mix": [
      {
        "category": "read",
        "percent": 45
      },
      {
        "category": "search",
        "percent": 10
      },
      {
        "category": "notification_bookmark_read",
        "percent": 10
      },
      {
        "category": "content_write",
        "percent": 15
      },
      {
        "category": "interaction_write",
        "percent": 15
      },
      {
        "category": "identity_session",
        "percent": 5
      }
    ],
    "routes": [
      {
        "category": "read",
        "method": "GET",
        "template": "GET /api/v1/posts",
        "allowed_statuses": [
          200
        ]
      },
      {
        "category": "read",
        "method": "GET",
        "template": "GET /api/v1/posts/:postId",
        "allowed_statuses": [
          200
        ]
      },
      {
        "category": "read",
        "method": "GET",
        "template": "GET /api/v1/posts/following",
        "allowed_statuses": [
          200
        ]
      },
      {
        "category": "read",
        "method": "GET",
        "template": "GET /api/v1/posts/:postId/comments",
        "allowed_statuses": [
          200
        ]
      },
      {
        "category": "read",
        "method": "GET",
        "template": "GET /api/v1/users/:username",
        "allowed_statuses": [
          200
        ]
      },
      {
        "category": "search",
        "method": "GET",
        "template": "GET /api/v1/search/posts",
        "allowed_statuses": [
          200
        ]
      },
      {
        "category": "search",
        "method": "GET",
        "template": "GET /api/v1/search/users",
        "allowed_statuses": [
          200
        ]
      },
      {
        "category": "notification_bookmark_read",
        "method": "GET",
        "template": "GET /api/v1/notifications",
        "allowed_statuses": [
          200
        ]
      },
      {
        "category": "notification_bookmark_read",
        "method": "GET",
        "template": "GET /api/v1/bookmarks",
        "allowed_statuses": [
          200
        ]
      },
      {
        "category": "notification_bookmark_read",
        "method": "GET",
        "template": "GET /api/v1/users/me/following",
        "allowed_statuses": [
          200
        ]
      },
      {
        "category": "notification_bookmark_read",
        "method": "GET",
        "template": "GET /api/v1/users/me/followers",
        "allowed_statuses": [
          200
        ]
      },
      {
        "category": "content_write",
        "method": "POST",
        "template": "POST /api/v1/posts",
        "allowed_statuses": [
          201
        ]
      },
      {
        "category": "content_write",
        "method": "POST",
        "template": "POST /api/v1/posts/:postId/comments",
        "allowed_statuses": [
          201
        ]
      },
      {
        "category": "content_write",
        "method": "PATCH",
        "template": "PATCH /api/v1/posts/:postId",
        "allowed_statuses": [
          200
        ]
      },
      {
        "category": "content_write",
        "method": "DELETE",
        "template": "DELETE /api/v1/posts/:postId",
        "allowed_statuses": [
          204
        ]
      },
      {
        "category": "interaction_write",
        "method": "PUT",
        "template": "PUT /api/v1/posts/:postId/like",
        "allowed_statuses": [
          204
        ]
      },
      {
        "category": "interaction_write",
        "method": "DELETE",
        "template": "DELETE /api/v1/posts/:postId/like",
        "allowed_statuses": [
          204
        ]
      },
      {
        "category": "interaction_write",
        "method": "PUT",
        "template": "PUT /api/v1/users/:userId/follow",
        "allowed_statuses": [
          200
        ]
      },
      {
        "category": "interaction_write",
        "method": "DELETE",
        "template": "DELETE /api/v1/users/:userId/follow",
        "allowed_statuses": [
          200
        ]
      },
      {
        "category": "interaction_write",
        "method": "PUT",
        "template": "PUT /api/v1/posts/:postId/bookmark",
        "allowed_statuses": [
          204
        ]
      },
      {
        "category": "identity_session",
        "method": "POST",
        "template": "POST /api/v1/auth/login",
        "allowed_statuses": [
          200
        ]
      },
      {
        "category": "identity_session",
        "method": "GET",
        "template": "GET /api/v1/users/me",
        "allowed_statuses": [
          200
        ]
      }
    ]
  },
  "stages": [
    {
      "name": "rps-50",
      "target_rps": 50,
      "warmup_target_rps": 25,
      "warmup_seconds": 15,
      "measurement_seconds": 60,
      "recovery_seconds": 30
    },
    {
      "name": "rps-100",
      "target_rps": 100,
      "warmup_target_rps": 50,
      "warmup_seconds": 15,
      "measurement_seconds": 60,
      "recovery_seconds": 30
    },
    {
      "name": "rps-150",
      "target_rps": 150,
      "warmup_target_rps": 75,
      "warmup_seconds": 15,
      "measurement_seconds": 60,
      "recovery_seconds": 30
    },
    {
      "name": "rps-200",
      "target_rps": 200,
      "warmup_target_rps": 100,
      "warmup_seconds": 15,
      "measurement_seconds": 60,
      "recovery_seconds": 30
    }
  ],
  "repetitions": 3,
  "gates": {
    "synchronous": {
      "min_achieved_rps_ratio": 0.95,
      "max_p95_ms": 1000,
      "max_p99_ms": 2000,
      "max_timeout_rate": 0,
      "max_unexpected_error_rate": 0,
      "max_explicit_reject_rate": 0,
      "max_schedule_lag_ms": 100
    },
    "asynchronous": {
      "max_recovery_seconds": 120,
      "max_outbox_pending": 0,
      "max_rabbit_ready": 0,
      "max_rabbit_unacked": 0,
      "max_kafka_lag": 0
    },
    "observability": {
      "max_recovery_seconds": 120,
      "require_metric_progress": true,
      "require_log_progress": true,
      "require_event_progress": true
    }
  },
  "stop_conditions": {
    "oom": true,
    "ownership_lost": true,
    "unsafe_cleanup": true,
    "profile_hard_error": true,
    "preserve_unexecuted_stages": true
  },
  "sampling": {
    "interval_seconds": 5,
    "required_signals": [
      "host_cpu",
      "host_rss",
      "load_cpu",
      "load_rss",
      "load_scheduler_lag",
      "sut_cpu",
      "sut_rss",
      "sut_saturation",
      "outbox",
      "rabbitmq",
      "kafka_lag"
    ],
    "required_components": [
      "mysql",
      "redis",
      "rabbitmq",
      "elasticsearch",
      "observability-elasticsearch",
      "kafka",
      "victoriametrics",
      "backend",
      "backend-2",
      "business-worker",
      "business-worker-2",
      "search-indexer",
      "search-indexer-2",
      "marshaller",
      "marshaller-2",
      "monitor",
      "frontend",
      "admin-frontend"
    ]
  },
  "statistics": {
    "percentiles": [
      0.5,
      0.95,
      0.99
    ],
    "aggregations": [
      "median",
      "min",
      "max",
      "cv"
    ],
    "cv_definition": "population_stddev_div_mean_percent",
    "retain_raw_repetitions": true,
    "do_not_merge_latency_samples": true
  },
  "diagnostic": {
    "drain_seconds": 30,
    "recovery_seconds": 120,
    "poll_seconds": 1,
    "stage_isolation": "owned_empty_project",
    "clock_assumption": "same_host_utc",
    "clock_error_ms": 10,
    "metric_timestamp_quantization_ms": 1,
    "event_plugin_id": "redis-exporter",
    "event_operations": [
      "stop",
      "start"
    ],
    "observer_comparison": {
      "target_rps": 50,
      "seconds": 5,
      "workers": 8,
      "route": "GET /api/v1/users/me"
    }
  }
}
